...
, length 288
17:48:51.812002 IP 138.197.174.160.22 > 45.72.205.4.51699: Flags [P.], seq 348976:349152, ack 161, win 63072, length 176
17:48:51.812703 IP 45.72.205.4.51699 > 138.197.174.160.22: Flags [.], ack 344096, win 64240, length 0
17:48:51.812725 IP 138.197.174.160.22 > 45.72.205.4.51699: Flags [P.], seq 349152:349328, ack 161, win 63072, length 176
17:48:51.812824 IP 138.197.174.160.22 > 45.72.205.4.51699: Flags [P.], seq 349328:349616, ack 161, win 63072, length 288
17:48:51.812900 IP 138.197.174.160.22 > 45.72.205.4.51699: Flags [P.], seq 349616:349792, ack 161, win 63072, length 176
17:48:51.812969 IP 138.197.174.160.22 > 45.72.205.4.51699: Flags [P.], seq 349792:349968, ack 161, win 63072, length 176
17:48:51.813624 IP 45.72.205.4.51699 > 138.197.174.160.22: Flags [P.], seq 161:225, ack 344096, win 64240, length 64
^C
2017 packets captured
2018 packets received by filter
0 packets dropped by kernel
